<?xml version="1.0" encoding="UTF-8"?>
<!ELEMENT aptech (employe* , students*)>
<!ELEMENT employe (name , contact , email, salary)>
<!ELEMENT students (name , contact , email)>
<!ELEMENT name (#PCDATA)>
<!ELEMENT contact (#PCDATA)>
<!ELEMENT email (#PCDATA)>
<!ELEMENT salary (#PCDATA)>
